No.     Time           Source                Destination           Protocol Length Info
      1 0.000000       192.168.0.131         255.255.255.255       UDP      304    49531 → 6667 Len=262

Frame 1: 304 bytes on wire (2432 bits), 304 bytes captured (2432 bits) on interface \Device\NPF_{602D7947-81A3-478C-A47A-FCA514C4404E}, id 0
    Section number: 1
    Interface id: 0 (\Device\NPF_{602D7947-81A3-478C-A47A-FCA514C4404E})
        Interface name: \Device\NPF_{602D7947-81A3-478C-A47A-FCA514C4404E}
        Interface description: Wi-Fi
    Encapsulation type: Ethernet (1)
    Arrival Time: Mar 15, 2025 12:18:39.317586000 W. Europe Standard Time
    UTC Arrival Time: Mar 15, 2025 11:18:39.317586000 UTC
    Epoch Arrival Time: 1742037519.317586000
    [Time shift for this packet: 0.000000000 seconds]
    [Time delta from previous captured frame: 0.000000000 seconds]
    [Time delta from previous displayed frame: 0.000000000 seconds]
    [Time since reference or first frame: 0.000000000 seconds]
    Frame Number: 1
    Frame Length: 304 bytes (2432 bits)
    Capture Length: 304 bytes (2432 bits)
    [Frame is marked: False]
    [Frame is ignored: False]
    [Protocols in frame: eth:ethertype:ip:udp:data]
    [Coloring Rule Name: UDP]
    [Coloring Rule String: udp]
Ethernet II, Src: TendaTechnol_4b:7e:09 (cc:2d:21:4b:7e:09), Dst: Broadcast (ff:ff:ff:ff:ff:ff)
    Destination: Broadcast (ff:ff:ff:ff:ff:ff)
        .... ..1. .... .... .... .... = LG bit: Locally administered address (this is NOT the factory default)
        .... ...1 .... .... .... .... = IG bit: Group address (multicast/broadcast)
    Source: TendaTechnol_4b:7e:09 (cc:2d:21:4b:7e:09)
        .... ..0. .... .... .... .... = LG bit: Globally unique address (factory default)
        .... ...0 .... .... .... .... = IG bit: Individual address (unicast)
    Type: IPv4 (0x0800)
    [Stream index: 0]
Internet Protocol Version 4, Src: 192.168.0.131, Dst: 255.255.255.255
    0100 .... = Version: 4
    .... 0101 = Header Length: 20 bytes (5)
    Differentiated Services Field: 0x00 (DSCP: CS0, ECN: Not-ECT)
        0000 00.. = Differentiated Services Codepoint: Default (0)
        .... ..00 = Explicit Congestion Notification: Not ECN-Capable Transport (0)
    Total Length: 290
    Identification: 0xc5c2 (50626)
    000. .... = Flags: 0x0
        0... .... = Reserved bit: Not set
        .0.. .... = Don't fragment: Not set
        ..0. .... = More fragments: Not set
    ...0 0000 0000 0000 = Fragment Offset: 0
    Time to Live: 255
    Protocol: UDP (17)
    Header Checksum: 0x33dd [validation disabled]
    [Header checksum status: Unverified]
    Source Address: 192.168.0.131
    Destination Address: 255.255.255.255
    [Stream index: 0]
User Datagram Protocol, Src Port: 49531, Dst Port: 6667
Data (262 bytes)

0000  00 00 66 99 00 00 00 00 00 00 00 00 00 13 00 00   ..f.............
0010  00 f0 8b 38 9c 3c 19 43 07 fa f2 36 c6 19 c8 8f   ...8.<.C...6....
0020  a0 d9 22 78 fb 8f e0 b9 3f ec 30 fd c4 e0 89 7a   .."x....?.0....z
0030  53 20 0c fe 31 58 2b ed 5f 07 3d 20 30 f3 81 ae   S ..1X+._.= 0...
0040  b3 c8 98 9c bd 93 4b 8f 4b 10 6e 0a 13 bc c2 a7   ......K.K.n.....
0050  79 cf 60 b3 36 18 00 1f a9 b4 24 46 64 49 52 5f   y.`.6.....$FdIR_
0060  b6 7f bb 1d 9c 9d 79 8f 9a 50 e8 6e e1 e6 41 6c   ......y..P.n..Al
0070  33 0b ff 62 b1 c7 85 5c 53 69 de 19 ae 1b dd e2   3..b...\Si......
0080  a8 70 04 ed 42 98 6c 46 04 e4 b6 af 30 d3 6d 77   .p..B.lF....0.mw
0090  68 d6 fc d6 90 4b ff b2 d2 40 b1 8e bf 35 3d 96   h....K...@...5=.
00a0  e0 ae 6a 0b 5d d3 59 c8 79 af 89 42 76 4f 7e ec   ..j.].Y.y..BvO~.
00b0  13 4e 64 9c d7 58 18 3a 39 ff af f9 58 fd ea e7   .Nd..X.:9...X...
00c0  31 28 26 23 81 0c 92 e1 21 14 a0 c9 91 02 73 9e   1(&#....!.....s.
00d0  cb af 12 fe 98 77 5a 0d a6 b0 32 5c 0d 57 99 5f   .....wZ...2\.W._
00e0  b0 bc 1d 85 e6 d6 10 0f 69 27 9b 55 6b 9a 3b 2d   ........i'.Uk.;-
00f0  3d 88 d8 c9 72 60 99 58 e4 b8 18 e4 43 5f 24 86   =...r`.X....C_$.
0100  91 ed 00 00 99 66                                 .....f

No.     Time           Source                Destination           Protocol Length Info
      2 0.309232       192.168.0.129         255.255.255.255       UDP      214    49158 → 6667 Len=172

Frame 2: 214 bytes on wire (1712 bits), 214 bytes captured (1712 bits) on interface \Device\NPF_{602D7947-81A3-478C-A47A-FCA514C4404E}, id 0
    Section number: 1
    Interface id: 0 (\Device\NPF_{602D7947-81A3-478C-A47A-FCA514C4404E})
        Interface name: \Device\NPF_{602D7947-81A3-478C-A47A-FCA514C4404E}
        Interface description: Wi-Fi
    Encapsulation type: Ethernet (1)
    Arrival Time: Mar 15, 2025 12:18:39.626818000 W. Europe Standard Time
    UTC Arrival Time: Mar 15, 2025 11:18:39.626818000 UTC
    Epoch Arrival Time: 1742037519.626818000
    [Time shift for this packet: 0.000000000 seconds]
    [Time delta from previous captured frame: 0.309232000 seconds]
    [Time delta from previous displayed frame: 0.309232000 seconds]
    [Time since reference or first frame: 0.309232000 seconds]
    Frame Number: 2
    Frame Length: 214 bytes (1712 bits)
    Capture Length: 214 bytes (1712 bits)
    [Frame is marked: False]
    [Frame is ignored: False]
    [Protocols in frame: eth:ethertype:ip:udp:data]
    [Coloring Rule Name: UDP]
    [Coloring Rule String: udp]
Ethernet II, Src: TuyaSmart_44:98:ec (18:69:d8:44:98:ec), Dst: Broadcast (ff:ff:ff:ff:ff:ff)
    Destination: Broadcast (ff:ff:ff:ff:ff:ff)
        .... ..1. .... .... .... .... = LG bit: Locally administered address (this is NOT the factory default)
        .... ...1 .... .... .... .... = IG bit: Group address (multicast/broadcast)
    Source: TuyaSmart_44:98:ec (18:69:d8:44:98:ec)
        .... ..0. .... .... .... .... = LG bit: Globally unique address (factory default)
        .... ...0 .... .... .... .... = IG bit: Individual address (unicast)
    Type: IPv4 (0x0800)
    [Stream index: 1]
Internet Protocol Version 4, Src: 192.168.0.129, Dst: 255.255.255.255
    0100 .... = Version: 4
    .... 0101 = Header Length: 20 bytes (5)
    Differentiated Services Field: 0x00 (DSCP: CS0, ECN: Not-ECT)
        0000 00.. = Differentiated Services Codepoint: Default (0)
        .... ..00 = Explicit Congestion Notification: Not ECN-Capable Transport (0)
    Total Length: 200
    Identification: 0x8e3f (36415)
    000. .... = Flags: 0x0
        0... .... = Reserved bit: Not set
        .0.. .... = Don't fragment: Not set
        ..0. .... = More fragments: Not set
    ...0 0000 0000 0000 = Fragment Offset: 0
    Time to Live: 255
    Protocol: UDP (17)
    Header Checksum: 0x6bbc [validation disabled]
    [Header checksum status: Unverified]
    Source Address: 192.168.0.129
    Destination Address: 255.255.255.255
    [Stream index: 1]
User Datagram Protocol, Src Port: 49158, Dst Port: 6667
Data (172 bytes)

0000  00 00 55 aa 00 00 00 00 00 00 00 13 00 00 00 9c   ..U.............
0010  00 00 00 00 23 d0 1e 5f ef 56 83 33 14 ce f6 0f   ....#.._.V.3....
0020  b0 86 ed 33 96 8f e9 07 f9 a7 d5 3a 34 05 8c 64   ...3.......:4..d
0030  dd 7e 84 29 b1 41 ab 95 6f fc 66 18 1f f0 71 12   .~.).A..o.f...q.
0040  fe 0b 8a 6a 0b db 68 3d 91 f4 b7 ab 4a 21 8c 47   ...j..h=....J!.G
0050  b2 25 06 a2 72 56 f9 92 ef 0b b3 c9 94 6f 6c a8   .%..rV.......ol.
0060  e2 e1 48 53 2e 0d bc 9a 92 c3 31 72 86 eb f2 38   ..HS......1r...8
0070  be 57 97 86 c6 40 cd bf 0b 12 c4 f2 8e 58 bf e0   .W...@.......X..
0080  cb 82 c8 f5 66 47 29 7d 0d cb ac f3 d8 1c 17 9a   ....fG)}........
0090  85 5a 42 16 7a 23 e3 b2 24 9f 5a df 48 a7 14 f8   .ZB.z#..$.Z.H...
00a0  51 aa f4 39 96 20 94 84 00 00 aa 55               Q..9. .....U

No.     Time           Source                Destination           Protocol Length Info
      3 0.309232       SamsungElect_a4:b1:97 Broadcast             ARP      60     Who has 192.168.0.1? Tell 192.168.0.148

Frame 3: 60 bytes on wire (480 bits), 60 bytes captured (480 bits) on interface \Device\NPF_{602D7947-81A3-478C-A47A-FCA514C4404E}, id 0
    Section number: 1
    Interface id: 0 (\Device\NPF_{602D7947-81A3-478C-A47A-FCA514C4404E})
        Interface name: \Device\NPF_{602D7947-81A3-478C-A47A-FCA514C4404E}
        Interface description: Wi-Fi
    Encapsulation type: Ethernet (1)
    Arrival Time: Mar 15, 2025 12:18:39.626818000 W. Europe Standard Time
    UTC Arrival Time: Mar 15, 2025 11:18:39.626818000 UTC
    Epoch Arrival Time: 1742037519.626818000
    [Time shift for this packet: 0.000000000 seconds]
    [Time delta from previous captured frame: 0.000000000 seconds]
    [Time delta from previous displayed frame: 0.000000000 seconds]
    [Time since reference or first frame: 0.309232000 seconds]
    Frame Number: 3
    Frame Length: 60 bytes (480 bits)
    Capture Length: 60 bytes (480 bits)
    [Frame is marked: False]
    [Frame is ignored: False]
    [Protocols in frame: eth:ethertype:arp]
    [Coloring Rule Name: ARP]
    [Coloring Rule String: arp]
Ethernet II, Src: SamsungElect_a4:b1:97 (64:1c:b0:a4:b1:97), Dst: Broadcast (ff:ff:ff:ff:ff:ff)
    Destination: Broadcast (ff:ff:ff:ff:ff:ff)
        .... ..1. .... .... .... .... = LG bit: Locally administered address (this is NOT the factory default)
        .... ...1 .... .... .... .... = IG bit: Group address (multicast/broadcast)
    Source: SamsungElect_a4:b1:97 (64:1c:b0:a4:b1:97)
        .... ..0. .... .... .... .... = LG bit: Globally unique address (factory default)
        .... ...0 .... .... .... .... = IG bit: Individual address (unicast)
    Type: ARP (0x0806)
    [Stream index: 2]
    Padding: 000000000000000000000000000000000000
Address Resolution Protocol (request)

No.     Time           Source                Destination           Protocol Length Info
      4 0.513584       192.168.0.148         239.255.255.250       UDP      77     44363 → 15600 Len=35

Frame 4: 77 bytes on wire (616 bits), 77 bytes captured (616 bits) on interface \Device\NPF_{602D7947-81A3-478C-A47A-FCA514C4404E}, id 0
    Section number: 1
    Interface id: 0 (\Device\NPF_{602D7947-81A3-478C-A47A-FCA514C4404E})
        Interface name: \Device\NPF_{602D7947-81A3-478C-A47A-FCA514C4404E}
        Interface description: Wi-Fi
    Encapsulation type: Ethernet (1)
    Arrival Time: Mar 15, 2025 12:18:39.831170000 W. Europe Standard Time
    UTC Arrival Time: Mar 15, 2025 11:18:39.831170000 UTC
    Epoch Arrival Time: 1742037519.831170000
    [Time shift for this packet: 0.000000000 seconds]
    [Time delta from previous captured frame: 0.204352000 seconds]
    [Time delta from previous displayed frame: 0.204352000 seconds]
    [Time since reference or first frame: 0.513584000 seconds]
    Frame Number: 4
    Frame Length: 77 bytes (616 bits)
    Capture Length: 77 bytes (616 bits)
    [Frame is marked: False]
    [Frame is ignored: False]
    [Protocols in frame: eth:ethertype:ip:udp:data]
    [Coloring Rule Name: UDP]
    [Coloring Rule String: udp]
Ethernet II, Src: SamsungElect_a4:b1:97 (64:1c:b0:a4:b1:97), Dst: IPv4mcast_7f:ff:fa (01:00:5e:7f:ff:fa)
    Destination: IPv4mcast_7f:ff:fa (01:00:5e:7f:ff:fa)
        .... ..0. .... .... .... .... = LG bit: Globally unique address (factory default)
        .... ...1 .... .... .... .... = IG bit: Group address (multicast/broadcast)
    Source: SamsungElect_a4:b1:97 (64:1c:b0:a4:b1:97)
        .... ..0. .... .... .... .... = LG bit: Globally unique address (factory default)
        .... ...0 .... .... .... .... = IG bit: Individual address (unicast)
    Type: IPv4 (0x0800)
    [Stream index: 3]
Internet Protocol Version 4, Src: 192.168.0.148, Dst: 239.255.255.250
    0100 .... = Version: 4
    .... 0101 = Header Length: 20 bytes (5)
    Differentiated Services Field: 0x00 (DSCP: CS0, ECN: Not-ECT)
        0000 00.. = Differentiated Services Codepoint: Default (0)
        .... ..00 = Explicit Congestion Notification: Not ECN-Capable Transport (0)
    Total Length: 63
    Identification: 0x79fb (31227)
    010. .... = Flags: 0x2, Don't fragment
        0... .... = Reserved bit: Not set
        .1.. .... = Don't fragment: Set
        ..0. .... = More fragments: Not set
    ...0 0000 0000 0000 = Fragment Offset: 0
    Time to Live: 64
    Protocol: UDP (17)
    Header Checksum: 0x0f7c [validation disabled]
    [Header checksum status: Unverified]
    Source Address: 192.168.0.148
    Destination Address: 239.255.255.250
    [Stream index: 2]
User Datagram Protocol, Src Port: 44363, Dst Port: 15600
Data (35 bytes)

0000  53 45 41 52 43 48 20 42 53 44 50 2f 30 2e 31 0a   SEARCH BSDP/0.1.
0010  44 45 56 49 43 45 3d 30 0a 53 45 52 56 49 43 45   DEVICE=0.SERVICE
0020  3d 31 0a                                          =1.

No.     Time           Source                Destination           Protocol Length Info
      5 0.624292       192.168.0.156         255.255.255.255       UDP      304    50615 → 6667 Len=262

Frame 5: 304 bytes on wire (2432 bits), 304 bytes captured (2432 bits) on interface \Device\NPF_{602D7947-81A3-478C-A47A-FCA514C4404E}, id 0
    Section number: 1
    Interface id: 0 (\Device\NPF_{602D7947-81A3-478C-A47A-FCA514C4404E})
        Interface name: \Device\NPF_{602D7947-81A3-478C-A47A-FCA514C4404E}
        Interface description: Wi-Fi
    Encapsulation type: Ethernet (1)
    Arrival Time: Mar 15, 2025 12:18:39.941878000 W. Europe Standard Time
    UTC Arrival Time: Mar 15, 2025 11:18:39.941878000 UTC
    Epoch Arrival Time: 1742037519.941878000
    [Time shift for this packet: 0.000000000 seconds]
    [Time delta from previous captured frame: 0.110708000 seconds]
    [Time delta from previous displayed frame: 0.110708000 seconds]
    [Time since reference or first frame: 0.624292000 seconds]
    Frame Number: 5
    Frame Length: 304 bytes (2432 bits)
    Capture Length: 304 bytes (2432 bits)
    [Frame is marked: False]
    [Frame is ignored: False]
    [Protocols in frame: eth:ethertype:ip:udp:data]
    [Coloring Rule Name: UDP]
    [Coloring Rule String: udp]
Ethernet II, Src: TuyaSmart_28:0b:22 (4c:a9:19:28:0b:22), Dst: Broadcast (ff:ff:ff:ff:ff:ff)
    Destination: Broadcast (ff:ff:ff:ff:ff:ff)
        .... ..1. .... .... .... .... = LG bit: Locally administered address (this is NOT the factory default)
        .... ...1 .... .... .... .... = IG bit: Group address (multicast/broadcast)
    Source: TuyaSmart_28:0b:22 (4c:a9:19:28:0b:22)
        .... ..0. .... .... .... .... = LG bit: Globally unique address (factory default)
        .... ...0 .... .... .... .... = IG bit: Individual address (unicast)
    Type: IPv4 (0x0800)
    [Stream index: 4]
Internet Protocol Version 4, Src: 192.168.0.156, Dst: 255.255.255.255
    0100 .... = Version: 4
    .... 0101 = Header Length: 20 bytes (5)
    Differentiated Services Field: 0x00 (DSCP: CS0, ECN: Not-ECT)
        0000 00.. = Differentiated Services Codepoint: Default (0)
        .... ..00 = Explicit Congestion Notification: Not ECN-Capable Transport (0)
    Total Length: 290
    Identification: 0xbfd2 (49106)
    000. .... = Flags: 0x0
        0... .... = Reserved bit: Not set
        .0.. .... = Don't fragment: Not set
        ..0. .... = More fragments: Not set
    ...0 0000 0000 0000 = Fragment Offset: 0
    Time to Live: 255
    Protocol: UDP (17)
    Header Checksum: 0x39b4 [validation disabled]
    [Header checksum status: Unverified]
    Source Address: 192.168.0.156
    Destination Address: 255.255.255.255
    [Stream index: 3]
User Datagram Protocol, Src Port: 50615, Dst Port: 6667
Data (262 bytes)

0000  00 00 66 99 00 00 00 00 00 00 00 00 00 13 00 00   ..f.............
0010  00 f0 68 be 74 2c 3d 86 73 c0 30 45 b6 ad 9f d7   ..h.t,=.s.0E....
0020  0e 39 b6 ff aa bb 3c ac 55 2b a0 38 67 78 bd ea   .9....<.U+.8gx..
0030  df 75 90 94 28 a6 27 90 e3 ac a0 42 56 86 65 40   .u..(.'....BV.e@
0040  d0 60 c2 86 01 3c bf 31 e7 92 84 a5 d5 2e a3 d9   .`...<.1........
0050  4d 89 f5 d4 4e f4 68 b8 eb f2 d3 67 46 6b 5a 53   M...N.h....gFkZS
0060  ea ba 41 b1 a2 5e e3 d1 3e 68 f4 c7 e5 78 13 48   ..A..^..>h...x.H
0070  32 76 b9 b1 95 a6 c9 4e 8f b6 20 f7 90 72 04 37   2v.....N.. ..r.7
0080  e5 64 bb 96 75 68 88 23 c7 45 a6 57 de 95 0c db   .d..uh.#.E.W....
0090  16 aa c7 6f b7 3a 39 44 29 0f 3a e3 c6 aa 85 6d   ...o.:9D).:....m
00a0  00 01 a9 7d 12 73 75 3b 6d 6a 61 69 69 31 00 b8   ...}.su;mjaii1..
00b0  f9 8e b1 35 7b a4 cd e0 6b 5f eb 79 dd 18 6b 4e   ...5{...k_.y..kN
00c0  88 78 58 ba d3 6a 20 18 1c 33 7e 73 8b 54 f9 d6   .xX..j ..3~s.T..
00d0  74 0b bb 47 7f 22 e2 64 1d f3 cd f4 a5 e6 17 de   t..G.".d........
00e0  ba 78 7a 06 ac bd 07 46 37 e7 09 d8 3b c9 19 d4   .xz....F7...;...
00f0  b1 c1 26 24 f9 fe 7f 80 ca a4 cc 34 3b f1 e1 b3   ..&$.......4;...
0100  c9 4e 00 00 99 66                                 .N...f

No.     Time           Source                Destination           Protocol Length Info
      6 0.717809       TendaTechnol_4b:7e:09 Broadcast             ARP      60     Who has 192.168.0.30? Tell 192.168.0.10

Frame 6: 60 bytes on wire (480 bits), 60 bytes captured (480 bits) on interface \Device\NPF_{602D7947-81A3-478C-A47A-FCA514C4404E}, id 0
    Section number: 1
    Interface id: 0 (\Device\NPF_{602D7947-81A3-478C-A47A-FCA514C4404E})
        Interface name: \Device\NPF_{602D7947-81A3-478C-A47A-FCA514C4404E}
        Interface description: Wi-Fi
    Encapsulation type: Ethernet (1)
    Arrival Time: Mar 15, 2025 12:18:40.035395000 W. Europe Standard Time
    UTC Arrival Time: Mar 15, 2025 11:18:40.035395000 UTC
    Epoch Arrival Time: 1742037520.035395000
    [Time shift for this packet: 0.000000000 seconds]
    [Time delta from previous captured frame: 0.093517000 seconds]
    [Time delta from previous displayed frame: 0.093517000 seconds]
    [Time since reference or first frame: 0.717809000 seconds]
    Frame Number: 6
    Frame Length: 60 bytes (480 bits)
    Capture Length: 60 bytes (480 bits)
    [Frame is marked: False]
    [Frame is ignored: False]
    [Protocols in frame: eth:ethertype:arp]
    [Coloring Rule Name: ARP]
    [Coloring Rule String: arp]
Ethernet II, Src: TendaTechnol_4b:7e:09 (cc:2d:21:4b:7e:09), Dst: Broadcast (ff:ff:ff:ff:ff:ff)
    Destination: Broadcast (ff:ff:ff:ff:ff:ff)
        .... ..1. .... .... .... .... = LG bit: Locally administered address (this is NOT the factory default)
        .... ...1 .... .... .... .... = IG bit: Group address (multicast/broadcast)
    Source: TendaTechnol_4b:7e:09 (cc:2d:21:4b:7e:09)
        .... ..0. .... .... .... .... = LG bit: Globally unique address (factory default)
        .... ...0 .... .... .... .... = IG bit: Individual address (unicast)
    Type: ARP (0x0806)
    [Stream index: 0]
    Padding: 000000000000000000000000000000000000
Address Resolution Protocol (request)

No.     Time           Source                Destination           Protocol Length Info
      7 0.743089       192.168.0.226         192.168.0.11          TCP      66     4378 → 80 [SYN] Seq=0 Win=65535 Len=0 MSS=1460 WS=256 SACK_PERM

Frame 7: 66 bytes on wire (528 bits), 66 bytes captured (528 bits) on interface \Device\NPF_{602D7947-81A3-478C-A47A-FCA514C4404E}, id 0
    Section number: 1
    Interface id: 0 (\Device\NPF_{602D7947-81A3-478C-A47A-FCA514C4404E})
        Interface name: \Device\NPF_{602D7947-81A3-478C-A47A-FCA514C4404E}
        Interface description: Wi-Fi
    Encapsulation type: Ethernet (1)
    Arrival Time: Mar 15, 2025 12:18:40.060675000 W. Europe Standard Time
    UTC Arrival Time: Mar 15, 2025 11:18:40.060675000 UTC
    Epoch Arrival Time: 1742037520.060675000
    [Time shift for this packet: 0.000000000 seconds]
    [Time delta from previous captured frame: 0.025280000 seconds]
    [Time delta from previous displayed frame: 0.025280000 seconds]
    [Time since reference or first frame: 0.743089000 seconds]
    Frame Number: 7
    Frame Length: 66 bytes (528 bits)
    Capture Length: 66 bytes (528 bits)
    [Frame is marked: False]
    [Frame is ignored: False]
    [Protocols in frame: eth:ethertype:ip:tcp]
    [Coloring Rule Name: HTTP]
    [Coloring Rule String: http || tcp.port == 80 || http2]
Ethernet II, Src: Intel_53:09:21 (e8:c8:29:53:09:21), Dst: TendaTechnol_4b:7e:09 (cc:2d:21:4b:7e:09)
    Destination: TendaTechnol_4b:7e:09 (cc:2d:21:4b:7e:09)
        .... ..0. .... .... .... .... = LG bit: Globally unique address (factory default)
        .... ...0 .... .... .... .... = IG bit: Individual address (unicast)
    Source: Intel_53:09:21 (e8:c8:29:53:09:21)
        .... ..0. .... .... .... .... = LG bit: Globally unique address (factory default)
        .... ...0 .... .... .... .... = IG bit: Individual address (unicast)
    Type: IPv4 (0x0800)
    [Stream index: 5]
Internet Protocol Version 4, Src: 192.168.0.226, Dst: 192.168.0.11
    0100 .... = Version: 4
    .... 0101 = Header Length: 20 bytes (5)
    Differentiated Services Field: 0x00 (DSCP: CS0, ECN: Not-ECT)
        0000 00.. = Differentiated Services Codepoint: Default (0)
        .... ..00 = Explicit Congestion Notification: Not ECN-Capable Transport (0)
    Total Length: 52
    Identification: 0xbfb6 (49078)
    010. .... = Flags: 0x2, Don't fragment
        0... .... = Reserved bit: Not set
        .1.. .... = Don't fragment: Set
        ..0. .... = More fragments: Not set
    ...0 0000 0000 0000 = Fragment Offset: 0
    Time to Live: 128
    Protocol: TCP (6)
    Header Checksum: 0x0000 [validation disabled]
    [Header checksum status: Unverified]
    Source Address: 192.168.0.226
    Destination Address: 192.168.0.11
    [Stream index: 4]
Transmission Control Protocol, Src Port: 4378, Dst Port: 80, Seq: 0, Len: 0
    Source Port: 4378
    Destination Port: 80
    [Stream index: 0]
    [Stream Packet Number: 1]
    [Conversation completeness: Complete, WITH_DATA (47)]
        ..1. .... = RST: Present
        ...0 .... = FIN: Absent
        .... 1... = Data: Present
        .... .1.. = ACK: Present
        .... ..1. = SYN-ACK: Present
        .... ...1 = SYN: Present
        [Completeness Flags: R·DASS]
    [TCP Segment Len: 0]
    Sequence Number: 0    (relative sequence number)
    Sequence Number (raw): 299715834
    [Next Sequence Number: 1    (relative sequence number)]
    Acknowledgment Number: 0
    Acknowledgment number (raw): 0
    1000 .... = Header Length: 32 bytes (8)
    Flags: 0x002 (SYN)
        000. .... .... = Reserved: Not set
        ...0 .... .... = Accurate ECN: Not set
        .... 0... .... = Congestion Window Reduced: Not set
        .... .0.. .... = ECN-Echo: Not set
        .... ..0. .... = Urgent: Not set
        .... ...0 .... = Acknowledgment: Not set
        .... .... 0... = Push: Not set
        .... .... .0.. = Reset: Not set
        .... .... ..1. = Syn: Set
        .... .... ...0 = Fin: Not set
        [TCP Flags: ··········S·]
    Window: 65535
    [Calculated window size: 65535]
    Checksum: 0x8264 [unverified]
    [Checksum Status: Unverified]
    Urgent Pointer: 0
    Options: (12 bytes), Maximum segment size, No-Operation (NOP), Window scale, No-Operation (NOP), No-Operation (NOP), SACK permitted
    [Timestamps]
        [Time since first frame in this TCP stream: 0.000000000 seconds]
        [Time since previous frame in this TCP stream: 0.000000000 seconds]

No.     Time           Source                Destination           Protocol Length Info
      8 0.749201       192.168.0.11          192.168.0.226         TCP      60     80 → 4378 [SYN, ACK] Seq=0 Ack=1 Win=2048 Len=0 MSS=1460

Frame 8: 60 bytes on wire (480 bits), 60 bytes captured (480 bits) on interface \Device\NPF_{602D7947-81A3-478C-A47A-FCA514C4404E}, id 0
    Section number: 1
    Interface id: 0 (\Device\NPF_{602D7947-81A3-478C-A47A-FCA514C4404E})
        Interface name: \Device\NPF_{602D7947-81A3-478C-A47A-FCA514C4404E}
        Interface description: Wi-Fi
    Encapsulation type: Ethernet (1)
    Arrival Time: Mar 15, 2025 12:18:40.066787000 W. Europe Standard Time
    UTC Arrival Time: Mar 15, 2025 11:18:40.066787000 UTC
    Epoch Arrival Time: 1742037520.066787000
    [Time shift for this packet: 0.000000000 seconds]
    [Time delta from previous captured frame: 0.006112000 seconds]
    [Time delta from previous displayed frame: 0.006112000 seconds]
    [Time since reference or first frame: 0.749201000 seconds]
    Frame Number: 8
    Frame Length: 60 bytes (480 bits)
    Capture Length: 60 bytes (480 bits)
    [Frame is marked: False]
    [Frame is ignored: False]
    [Protocols in frame: eth:ethertype:ip:tcp]
    [Coloring Rule Name: HTTP]
    [Coloring Rule String: http || tcp.port == 80 || http2]
Ethernet II, Src: TendaTechnol_4b:7e:09 (cc:2d:21:4b:7e:09), Dst: Intel_53:09:21 (e8:c8:29:53:09:21)
    Destination: Intel_53:09:21 (e8:c8:29:53:09:21)
        .... ..0. .... .... .... .... = LG bit: Globally unique address (factory default)
        .... ...0 .... .... .... .... = IG bit: Individual address (unicast)
    Source: TendaTechnol_4b:7e:09 (cc:2d:21:4b:7e:09)
        .... ..0. .... .... .... .... = LG bit: Globally unique address (factory default)
        .... ...0 .... .... .... .... = IG bit: Individual address (unicast)
    Type: IPv4 (0x0800)
    [Stream index: 5]
    Padding: 0000
Internet Protocol Version 4, Src: 192.168.0.11, Dst: 192.168.0.226
    0100 .... = Version: 4
    .... 0101 = Header Length: 20 bytes (5)
    Differentiated Services Field: 0x00 (DSCP: CS0, ECN: Not-ECT)
        0000 00.. = Differentiated Services Codepoint: Default (0)
        .... ..00 = Explicit Congestion Notification: Not ECN-Capable Transport (0)
    Total Length: 44
    Identification: 0x0001 (1)
    010. .... = Flags: 0x2, Don't fragment
        0... .... = Reserved bit: Not set
        .1.. .... = Don't fragment: Set
        ..0. .... = More fragments: Not set
    ...0 0000 0000 0000 = Fragment Offset: 0
    Time to Live: 128
    Protocol: TCP (6)
    Header Checksum: 0x788d [validation disabled]
    [Header checksum status: Unverified]
    Source Address: 192.168.0.11
    Destination Address: 192.168.0.226
    [Stream index: 4]
Transmission Control Protocol, Src Port: 80, Dst Port: 4378, Seq: 0, Ack: 1, Len: 0
    Source Port: 80
    Destination Port: 4378
    [Stream index: 0]
    [Stream Packet Number: 2]
    [Conversation completeness: Complete, WITH_DATA (47)]
        ..1. .... = RST: Present
        ...0 .... = FIN: Absent
        .... 1... = Data: Present
        .... .1.. = ACK: Present
        .... ..1. = SYN-ACK: Present
        .... ...1 = SYN: Present
        [Completeness Flags: R·DASS]
    [TCP Segment Len: 0]
    Sequence Number: 0    (relative sequence number)
    Sequence Number (raw): 2124493713
    [Next Sequence Number: 1    (relative sequence number)]
    Acknowledgment Number: 1    (relative ack number)
    Acknowledgment number (raw): 299715835
    0110 .... = Header Length: 24 bytes (6)
    Flags: 0x012 (SYN, ACK)
        000. .... .... = Reserved: Not set
        ...0 .... .... = Accurate ECN: Not set
        .... 0... .... = Congestion Window Reduced: Not set
        .... .0.. .... = ECN-Echo: Not set
        .... ..0. .... = Urgent: Not set
        .... ...1 .... = Acknowledgment: Set
        .... .... 0... = Push: Not set
        .... .... .0.. = Reset: Not set
        .... .... ..1. = Syn: Set
        .... .... ...0 = Fin: Not set
        [TCP Flags: ·······A··S·]
    Window: 2048
    [Calculated window size: 2048]
    Checksum: 0xeb63 [unverified]
    [Checksum Status: Unverified]
    Urgent Pointer: 0
    Options: (4 bytes), Maximum segment size
    [Timestamps]
        [Time since first frame in this TCP stream: 0.006112000 seconds]
        [Time since previous frame in this TCP stream: 0.006112000 seconds]
    [SEQ/ACK analysis]
        [This is an ACK to the segment in frame: 7]
        [The RTT to ACK the segment was: 0.006112000 seconds]
        [iRTT: 0.006199000 seconds]

No.     Time           Source                Destination           Protocol Length Info
      9 0.749288       192.168.0.226         192.168.0.11          TCP      54     4378 → 80 [ACK] Seq=1 Ack=1 Win=65535 Len=0

Frame 9: 54 bytes on wire (432 bits), 54 bytes captured (432 bits) on interface \Device\NPF_{602D7947-81A3-478C-A47A-FCA514C4404E}, id 0
    Section number: 1
    Interface id: 0 (\Device\NPF_{602D7947-81A3-478C-A47A-FCA514C4404E})
        Interface name: \Device\NPF_{602D7947-81A3-478C-A47A-FCA514C4404E}
        Interface description: Wi-Fi
    Encapsulation type: Ethernet (1)
    Arrival Time: Mar 15, 2025 12:18:40.066874000 W. Europe Standard Time
    UTC Arrival Time: Mar 15, 2025 11:18:40.066874000 UTC
    Epoch Arrival Time: 1742037520.066874000
    [Time shift for this packet: 0.000000000 seconds]
    [Time delta from previous captured frame: 0.000087000 seconds]
    [Time delta from previous displayed frame: 0.000087000 seconds]
    [Time since reference or first frame: 0.749288000 seconds]
    Frame Number: 9
    Frame Length: 54 bytes (432 bits)
    Capture Length: 54 bytes (432 bits)
    [Frame is marked: False]
    [Frame is ignored: False]
    [Protocols in frame: eth:ethertype:ip:tcp]
    [Coloring Rule Name: HTTP]
    [Coloring Rule String: http || tcp.port == 80 || http2]
Ethernet II, Src: Intel_53:09:21 (e8:c8:29:53:09:21), Dst: TendaTechnol_4b:7e:09 (cc:2d:21:4b:7e:09)
    Destination: TendaTechnol_4b:7e:09 (cc:2d:21:4b:7e:09)
        .... ..0. .... .... .... .... = LG bit: Globally unique address (factory default)
        .... ...0 .... .... .... .... = IG bit: Individual address (unicast)
    Source: Intel_53:09:21 (e8:c8:29:53:09:21)
        .... ..0. .... .... .... .... = LG bit: Globally unique address (factory default)
        .... ...0 .... .... .... .... = IG bit: Individual address (unicast)
    Type: IPv4 (0x0800)
    [Stream index: 5]
Internet Protocol Version 4, Src: 192.168.0.226, Dst: 192.168.0.11
    0100 .... = Version: 4
    .... 0101 = Header Length: 20 bytes (5)
    Differentiated Services Field: 0x00 (DSCP: CS0, ECN: Not-ECT)
        0000 00.. = Differentiated Services Codepoint: Default (0)
        .... ..00 = Explicit Congestion Notification: Not ECN-Capable Transport (0)
    Total Length: 40
    Identification: 0xbfb7 (49079)
    010. .... = Flags: 0x2, Don't fragment
        0... .... = Reserved bit: Not set
        .1.. .... = Don't fragment: Set
        ..0. .... = More fragments: Not set
    ...0 0000 0000 0000 = Fragment Offset: 0
    Time to Live: 128
    Protocol: TCP (6)
    Header Checksum: 0x0000 [validation disabled]
    [Header checksum status: Unverified]
    Source Address: 192.168.0.226
    Destination Address: 192.168.0.11
    [Stream index: 4]
Transmission Control Protocol, Src Port: 4378, Dst Port: 80, Seq: 1, Ack: 1, Len: 0
    Source Port: 4378
    Destination Port: 80
    [Stream index: 0]
    [Stream Packet Number: 3]
    [Conversation completeness: Complete, WITH_DATA (47)]
        ..1. .... = RST: Present
        ...0 .... = FIN: Absent
        .... 1... = Data: Present
        .... .1.. = ACK: Present
        .... ..1. = SYN-ACK: Present
        .... ...1 = SYN: Present
        [Completeness Flags: R·DASS]
    [TCP Segment Len: 0]
    Sequence Number: 1    (relative sequence number)
    Sequence Number (raw): 299715835
    [Next Sequence Number: 1    (relative sequence number)]
    Acknowledgment Number: 1    (relative ack number)
    Acknowledgment number (raw): 2124493714
    0101 .... = Header Length: 20 bytes (5)
    Flags: 0x010 (ACK)
        000. .... .... = Reserved: Not set
        ...0 .... .... = Accurate ECN: Not set
        .... 0... .... = Congestion Window Reduced: Not set
        .... .0.. .... = ECN-Echo: Not set
        .... ..0. .... = Urgent: Not set
        .... ...1 .... = Acknowledgment: Set
        .... .... 0... = Push: Not set
        .... .... .0.. = Reset: Not set
        .... .... ..0. = Syn: Not set
        .... .... ...0 = Fin: Not set
        [TCP Flags: ·······A····]
    Window: 65535
    [Calculated window size: 65535]
    [Window size scaling factor: -2 (no window scaling used)]
    Checksum: 0x8258 [unverified]
    [Checksum Status: Unverified]
    Urgent Pointer: 0
    [Timestamps]
        [Time since first frame in this TCP stream: 0.006199000 seconds]
        [Time since previous frame in this TCP stream: 0.000087000 seconds]
    [SEQ/ACK analysis]
        [This is an ACK to the segment in frame: 8]
        [The RTT to ACK the segment was: 0.000087000 seconds]
        [iRTT: 0.006199000 seconds]

No.     Time           Source                Destination           Protocol Length Info
     10 0.758251       192.168.0.226         192.168.0.11          HTTP     130    GET / HTTP/1.1 

Frame 10: 130 bytes on wire (1040 bits), 130 bytes captured (1040 bits) on interface \Device\NPF_{602D7947-81A3-478C-A47A-FCA514C4404E}, id 0
    Section number: 1
    Interface id: 0 (\Device\NPF_{602D7947-81A3-478C-A47A-FCA514C4404E})
        Interface name: \Device\NPF_{602D7947-81A3-478C-A47A-FCA514C4404E}
        Interface description: Wi-Fi
    Encapsulation type: Ethernet (1)
    Arrival Time: Mar 15, 2025 12:18:40.075837000 W. Europe Standard Time
    UTC Arrival Time: Mar 15, 2025 11:18:40.075837000 UTC
    Epoch Arrival Time: 1742037520.075837000
    [Time shift for this packet: 0.000000000 seconds]
    [Time delta from previous captured frame: 0.008963000 seconds]
    [Time delta from previous displayed frame: 0.008963000 seconds]
    [Time since reference or first frame: 0.758251000 seconds]
    Frame Number: 10
    Frame Length: 130 bytes (1040 bits)
    Capture Length: 130 bytes (1040 bits)
    [Frame is marked: False]
    [Frame is ignored: False]
    [Protocols in frame: eth:ethertype:ip:tcp:http]
    [Coloring Rule Name: HTTP]
    [Coloring Rule String: http || tcp.port == 80 || http2]
Ethernet II, Src: Intel_53:09:21 (e8:c8:29:53:09:21), Dst: TendaTechnol_4b:7e:09 (cc:2d:21:4b:7e:09)
    Destination: TendaTechnol_4b:7e:09 (cc:2d:21:4b:7e:09)
        .... ..0. .... .... .... .... = LG bit: Globally unique address (factory default)
        .... ...0 .... .... .... .... = IG bit: Individual address (unicast)
    Source: Intel_53:09:21 (e8:c8:29:53:09:21)
        .... ..0. .... .... .... .... = LG bit: Globally unique address (factory default)
        .... ...0 .... .... .... .... = IG bit: Individual address (unicast)
    Type: IPv4 (0x0800)
    [Stream index: 5]
Internet Protocol Version 4, Src: 192.168.0.226, Dst: 192.168.0.11
    0100 .... = Version: 4
    .... 0101 = Header Length: 20 bytes (5)
    Differentiated Services Field: 0x00 (DSCP: CS0, ECN: Not-ECT)
        0000 00.. = Differentiated Services Codepoint: Default (0)
        .... ..00 = Explicit Congestion Notification: Not ECN-Capable Transport (0)
    Total Length: 116
    Identification: 0xbfb8 (49080)
    010. .... = Flags: 0x2, Don't fragment
        0... .... = Reserved bit: Not set
        .1.. .... = Don't fragment: Set
        ..0. .... = More fragments: Not set
    ...0 0000 0000 0000 = Fragment Offset: 0
    Time to Live: 128
    Protocol: TCP (6)
    Header Checksum: 0x0000 [validation disabled]
    [Header checksum status: Unverified]
    Source Address: 192.168.0.226
    Destination Address: 192.168.0.11
    [Stream index: 4]
Transmission Control Protocol, Src Port: 4378, Dst Port: 80, Seq: 1, Ack: 1, Len: 76
    Source Port: 4378
    Destination Port: 80
    [Stream index: 0]
    [Stream Packet Number: 4]
    [Conversation completeness: Complete, WITH_DATA (47)]
        ..1. .... = RST: Present
        ...0 .... = FIN: Absent
        .... 1... = Data: Present
        .... .1.. = ACK: Present
        .... ..1. = SYN-ACK: Present
        .... ...1 = SYN: Present
        [Completeness Flags: R·DASS]
    [TCP Segment Len: 76]
    Sequence Number: 1    (relative sequence number)
    Sequence Number (raw): 299715835
    [Next Sequence Number: 77    (relative sequence number)]
    Acknowledgment Number: 1    (relative ack number)
    Acknowledgment number (raw): 2124493714
    0101 .... = Header Length: 20 bytes (5)
    Flags: 0x018 (PSH, ACK)
        000. .... .... = Reserved: Not set
        ...0 .... .... = Accurate ECN: Not set
        .... 0... .... = Congestion Window Reduced: Not set
        .... .0.. .... = ECN-Echo: Not set
        .... ..0. .... = Urgent: Not set
        .... ...1 .... = Acknowledgment: Set
        .... .... 1... = Push: Set
        .... .... .0.. = Reset: Not set
        .... .... ..0. = Syn: Not set
        .... .... ...0 = Fin: Not set
        [TCP Flags: ·······AP···]
    Window: 65535
    [Calculated window size: 65535]
    [Window size scaling factor: -2 (no window scaling used)]
    Checksum: 0x82a4 [unverified]
    [Checksum Status: Unverified]
    Urgent Pointer: 0
    [Timestamps]
        [Time since first frame in this TCP stream: 0.015162000 seconds]
        [Time since previous frame in this TCP stream: 0.008963000 seconds]
    [SEQ/ACK analysis]
        [iRTT: 0.006199000 seconds]
        [Bytes in flight: 76]
        [Bytes sent since last PSH flag: 76]
    TCP payload (76 bytes)
Hypertext Transfer Protocol
    GET / HTTP/1.1\r\n
    Host: 192.168.0.11\r\n
    User-Agent: curl/8.10.1\r\n
    Accept: */*\r\n
    \r\n
    [Full request URI: http://192.168.0.11/]

No.     Time           Source                Destination           Protocol Length Info
     11 0.787446       192.168.0.11          192.168.0.226         HTTP     1514   Continuation

Frame 11: 1514 bytes on wire (12112 bits), 1514 bytes captured (12112 bits) on interface \Device\NPF_{602D7947-81A3-478C-A47A-FCA514C4404E}, id 0
    Section number: 1
    Interface id: 0 (\Device\NPF_{602D7947-81A3-478C-A47A-FCA514C4404E})
        Interface name: \Device\NPF_{602D7947-81A3-478C-A47A-FCA514C4404E}
        Interface description: Wi-Fi
    Encapsulation type: Ethernet (1)
    Arrival Time: Mar 15, 2025 12:18:40.105032000 W. Europe Standard Time
    UTC Arrival Time: Mar 15, 2025 11:18:40.105032000 UTC
    Epoch Arrival Time: 1742037520.105032000
    [Time shift for this packet: 0.000000000 seconds]
    [Time delta from previous captured frame: 0.029195000 seconds]
    [Time delta from previous displayed frame: 0.029195000 seconds]
    [Time since reference or first frame: 0.787446000 seconds]
    Frame Number: 11
    Frame Length: 1514 bytes (12112 bits)
    Capture Length: 1514 bytes (12112 bits)
    [Frame is marked: False]
    [Frame is ignored: False]
    [Protocols in frame: eth:ethertype:ip:tcp:http:data]
    [Coloring Rule Name: HTTP]
    [Coloring Rule String: http || tcp.port == 80 || http2]
Ethernet II, Src: TendaTechnol_4b:7e:09 (cc:2d:21:4b:7e:09), Dst: Intel_53:09:21 (e8:c8:29:53:09:21)
    Destination: Intel_53:09:21 (e8:c8:29:53:09:21)
        .... ..0. .... .... .... .... = LG bit: Globally unique address (factory default)
        .... ...0 .... .... .... .... = IG bit: Individual address (unicast)
    Source: TendaTechnol_4b:7e:09 (cc:2d:21:4b:7e:09)
        .... ..0. .... .... .... .... = LG bit: Globally unique address (factory default)
        .... ...0 .... .... .... .... = IG bit: Individual address (unicast)
    Type: IPv4 (0x0800)
    [Stream index: 5]
Internet Protocol Version 4, Src: 192.168.0.11, Dst: 192.168.0.226
    0100 .... = Version: 4
    .... 0101 = Header Length: 20 bytes (5)
    Differentiated Services Field: 0x00 (DSCP: CS0, ECN: Not-ECT)
        0000 00.. = Differentiated Services Codepoint: Default (0)
        .... ..00 = Explicit Congestion Notification: Not ECN-Capable Transport (0)
    Total Length: 1500
    Identification: 0x0002 (2)
    010. .... = Flags: 0x2, Don't fragment
        0... .... = Reserved bit: Not set
        .1.. .... = Don't fragment: Set
        ..0. .... = More fragments: Not set
    ...0 0000 0000 0000 = Fragment Offset: 0
    Time to Live: 128
    Protocol: TCP (6)
    Header Checksum: 0x72dc [validation disabled]
    [Header checksum status: Unverified]
    Source Address: 192.168.0.11
    Destination Address: 192.168.0.226
    [Stream index: 4]
Transmission Control Protocol, Src Port: 80, Dst Port: 4378, Seq: 1, Ack: 77, Len: 1460
    Source Port: 80
    Destination Port: 4378
