No.     Time           Source                Destination           Protocol Length Info
      1 0.000000       192.168.0.155         255.255.255.255       UDP      304    56429 → 6667 Len=262

Frame 1: 304 bytes on wire (2432 bits), 304 bytes captured (2432 bits) on interface \Device\NPF_{602D7947-81A3-478C-A47A-FCA514C4404E}, id 0
    Section number: 1
    Interface id: 0 (\Device\NPF_{602D7947-81A3-478C-A47A-FCA514C4404E})
        Interface name: \Device\NPF_{602D7947-81A3-478C-A47A-FCA514C4404E}
        Interface description: Wi-Fi
    Encapsulation type: Ethernet (1)
    Arrival Time: Mar 15, 2025 12:04:46.118317000 W. Europe Standard Time
    UTC Arrival Time: Mar 15, 2025 11:04:46.118317000 UTC
    Epoch Arrival Time: 1742036686.118317000
    [Time shift for this packet: 0.000000000 seconds]
    [Time delta from previous captured frame: 0.000000000 seconds]
    [Time delta from previous displayed frame: 0.000000000 seconds]
    [Time since reference or first frame: 0.000000000 seconds]
    Frame Number: 1
    Frame Length: 304 bytes (2432 bits)
    Capture Length: 304 bytes (2432 bits)
    [Frame is marked: False]
    [Frame is ignored: False]
    [Protocols in frame: eth:ethertype:ip:udp:data]
    [Coloring Rule Name: UDP]
    [Coloring Rule String: udp]
Ethernet II, Src: TendaTechnol_4b:7e:09 (cc:2d:21:4b:7e:09), Dst: Broadcast (ff:ff:ff:ff:ff:ff)
    Destination: Broadcast (ff:ff:ff:ff:ff:ff)
        .... ..1. .... .... .... .... = LG bit: Locally administered address (this is NOT the factory default)
        .... ...1 .... .... .... .... = IG bit: Group address (multicast/broadcast)
    Source: TendaTechnol_4b:7e:09 (cc:2d:21:4b:7e:09)
        .... ..0. .... .... .... .... = LG bit: Globally unique address (factory default)
        .... ...0 .... .... .... .... = IG bit: Individual address (unicast)
    Type: IPv4 (0x0800)
    [Stream index: 0]
Internet Protocol Version 4, Src: 192.168.0.155, Dst: 255.255.255.255
    0100 .... = Version: 4
    .... 0101 = Header Length: 20 bytes (5)
    Differentiated Services Field: 0x00 (DSCP: CS0, ECN: Not-ECT)
        0000 00.. = Differentiated Services Codepoint: Default (0)
        .... ..00 = Explicit Congestion Notification: Not ECN-Capable Transport (0)
    Total Length: 290
    Identification: 0xddda (56794)
    000. .... = Flags: 0x0
        0... .... = Reserved bit: Not set
        .0.. .... = Don't fragment: Not set
        ..0. .... = More fragments: Not set
    ...0 0000 0000 0000 = Fragment Offset: 0
    Time to Live: 255
    Protocol: UDP (17)
    Header Checksum: 0x1bad [validation disabled]
    [Header checksum status: Unverified]
    Source Address: 192.168.0.155
    Destination Address: 255.255.255.255
    [Stream index: 0]
User Datagram Protocol, Src Port: 56429, Dst Port: 6667
Data (262 bytes)

0000  00 00 66 99 00 00 00 00 00 00 00 00 00 13 00 00   ..f.............
0010  00 f0 a7 35 31 9f d2 b6 d8 e5 9f d0 6e 67 be a6   ...51.......ng..
0020  69 90 62 69 5d 3c 57 f0 24 dd 58 8b 57 79 3d b9   i.bi]<W.$.X.Wy=.
0030  39 68 41 8a 68 5c b6 a8 81 b3 9a fa a1 82 c8 fc   9hA.h\..........
0040  70 29 46 c2 32 76 1f b2 09 08 95 d3 cd f4 5d 03   p)F.2v........].
0050  5c 0e 6f 9f a8 24 07 4f c2 17 cf 7a 27 d1 bd 6f   \.o..$.O...z'..o
0060  4f 3b b1 c1 97 5b c8 37 58 62 ed c7 e5 7f 7f 1f   O;...[.7Xb......
0070  eb e9 d5 97 aa 79 89 f5 96 76 db c2 13 8c 07 3a   .....y...v.....:
0080  33 b1 8e 2c 44 1f e9 ae 3c 81 d9 46 4b a6 16 0c   3..,D...<..FK...
0090  25 61 91 f8 46 f9 c4 cc f0 d6 3c 26 7d a9 60 f4   %a..F.....<&}.`.
00a0  4d 92 ba 4a b3 80 c8 41 4b 11 d9 73 f4 ef 69 e9   M..J...AK..s..i.
00b0  d5 ec df 95 22 31 1e e4 b5 41 2d 65 03 77 c0 be   ...."1...A-e.w..
00c0  eb bc 01 b2 03 6d 85 ee a7 ff 2f e1 da 8c af 97   .....m..../.....
00d0  84 f3 1d 53 c3 f4 ec 87 d5 f1 ed 2c 71 cb 2b 65   ...S.......,q.+e
00e0  61 d8 ac f5 fb f2 82 cd 8a 72 b2 94 d9 53 46 13   a........r...SF.
00f0  f8 57 31 9a 96 26 26 a2 9d 74 51 6a b1 e5 2e 97   .W1..&&..tQj....
0100  aa ee 00 00 99 66                                 .....f

No.     Time           Source                Destination           Protocol Length Info
      2 0.411293       TendaTechnol_4b:7e:09 Broadcast             ARP      60     Who has 192.168.0.30? Tell 192.168.0.10

Frame 2: 60 bytes on wire (480 bits), 60 bytes captured (480 bits) on interface \Device\NPF_{602D7947-81A3-478C-A47A-FCA514C4404E}, id 0
    Section number: 1
    Interface id: 0 (\Device\NPF_{602D7947-81A3-478C-A47A-FCA514C4404E})
        Interface name: \Device\NPF_{602D7947-81A3-478C-A47A-FCA514C4404E}
        Interface description: Wi-Fi
    Encapsulation type: Ethernet (1)
    Arrival Time: Mar 15, 2025 12:04:46.529610000 W. Europe Standard Time
    UTC Arrival Time: Mar 15, 2025 11:04:46.529610000 UTC
    Epoch Arrival Time: 1742036686.529610000
    [Time shift for this packet: 0.000000000 seconds]
    [Time delta from previous captured frame: 0.411293000 seconds]
    [Time delta from previous displayed frame: 0.411293000 seconds]
    [Time since reference or first frame: 0.411293000 seconds]
    Frame Number: 2
    Frame Length: 60 bytes (480 bits)
    Capture Length: 60 bytes (480 bits)
    [Frame is marked: False]
    [Frame is ignored: False]
    [Protocols in frame: eth:ethertype:arp]
    [Coloring Rule Name: ARP]
    [Coloring Rule String: arp]
Ethernet II, Src: TendaTechnol_4b:7e:09 (cc:2d:21:4b:7e:09), Dst: Broadcast (ff:ff:ff:ff:ff:ff)
    Destination: Broadcast (ff:ff:ff:ff:ff:ff)
        .... ..1. .... .... .... .... = LG bit: Locally administered address (this is NOT the factory default)
        .... ...1 .... .... .... .... = IG bit: Group address (multicast/broadcast)
    Source: TendaTechnol_4b:7e:09 (cc:2d:21:4b:7e:09)
        .... ..0. .... .... .... .... = LG bit: Globally unique address (factory default)
        .... ...0 .... .... .... .... = IG bit: Individual address (unicast)
    Type: ARP (0x0806)
    [Stream index: 0]
    Padding: 000000000000000000000000000000000000
Address Resolution Protocol (request)

No.     Time           Source                Destination           Protocol Length Info
      3 0.511801       192.168.0.195         255.255.255.255       UDP      214    55281 → 6667 Len=172

Frame 3: 214 bytes on wire (1712 bits), 214 bytes captured (1712 bits) on interface \Device\NPF_{602D7947-81A3-478C-A47A-FCA514C4404E}, id 0
    Section number: 1
    Interface id: 0 (\Device\NPF_{602D7947-81A3-478C-A47A-FCA514C4404E})
        Interface name: \Device\NPF_{602D7947-81A3-478C-A47A-FCA514C4404E}
        Interface description: Wi-Fi
    Encapsulation type: Ethernet (1)
    Arrival Time: Mar 15, 2025 12:04:46.630118000 W. Europe Standard Time
    UTC Arrival Time: Mar 15, 2025 11:04:46.630118000 UTC
    Epoch Arrival Time: 1742036686.630118000
    [Time shift for this packet: 0.000000000 seconds]
    [Time delta from previous captured frame: 0.100508000 seconds]
    [Time delta from previous displayed frame: 0.100508000 seconds]
    [Time since reference or first frame: 0.511801000 seconds]
    Frame Number: 3
    Frame Length: 214 bytes (1712 bits)
    Capture Length: 214 bytes (1712 bits)
    [Frame is marked: False]
    [Frame is ignored: False]
    [Protocols in frame: eth:ethertype:ip:udp:data]
    [Coloring Rule Name: UDP]
    [Coloring Rule String: udp]
Ethernet II, Src: TendaTechnol_4b:7e:09 (cc:2d:21:4b:7e:09), Dst: Broadcast (ff:ff:ff:ff:ff:ff)
    Destination: Broadcast (ff:ff:ff:ff:ff:ff)
        .... ..1. .... .... .... .... = LG bit: Locally administered address (this is NOT the factory default)
        .... ...1 .... .... .... .... = IG bit: Group address (multicast/broadcast)
    Source: TendaTechnol_4b:7e:09 (cc:2d:21:4b:7e:09)
        .... ..0. .... .... .... .... = LG bit: Globally unique address (factory default)
        .... ...0 .... .... .... .... = IG bit: Individual address (unicast)
    Type: IPv4 (0x0800)
    [Stream index: 0]
Internet Protocol Version 4, Src: 192.168.0.195, Dst: 255.255.255.255
    0100 .... = Version: 4
    .... 0101 = Header Length: 20 bytes (5)
    Differentiated Services Field: 0x00 (DSCP: CS0, ECN: Not-ECT)
        0000 00.. = Differentiated Services Codepoint: Default (0)
        .... ..00 = Explicit Congestion Notification: Not ECN-Capable Transport (0)
    Total Length: 200
    Identification: 0xf480 (62592)
    000. .... = Flags: 0x0
        0... .... = Reserved bit: Not set
        .0.. .... = Don't fragment: Not set
        ..0. .... = More fragments: Not set
    ...0 0000 0000 0000 = Fragment Offset: 0
    Time to Live: 255
    Protocol: UDP (17)
    Header Checksum: 0x0539 [validation disabled]
    [Header checksum status: Unverified]
    Source Address: 192.168.0.195
    Destination Address: 255.255.255.255
    [Stream index: 1]
User Datagram Protocol, Src Port: 55281, Dst Port: 6667
Data (172 bytes)

0000  00 00 55 aa 00 00 00 00 00 00 00 13 00 00 00 9c   ..U.............
0010  00 00 00 00 23 d0 1e 5f ef 56 83 33 14 ce f6 0f   ....#.._.V.3....
0020  b0 86 ed 33 c3 8f ed 61 71 91 9e 89 99 bf 29 70   ...3...aq.....)p
0030  36 46 d1 58 62 78 31 45 7e 79 e6 81 82 18 07 8e   6F.Xbx1E~y......
0040  18 a5 67 ba 07 4e aa 5c d2 8a 88 f9 45 6b 49 67   ..g..N.\....EkIg
0050  6a f6 ab 03 72 56 f9 92 ef 0b b3 c9 94 6f 6c a8   j...rV.......ol.
0060  e2 e1 48 53 2e 0d bc 9a 92 c3 31 72 86 eb f2 38   ..HS......1r...8
0070  be 57 97 86 c6 40 cd bf 0b 12 c4 f2 8e 58 bf e0   .W...@.......X..
0080  cb 82 c8 f5 66 47 29 7d 0d cb ac f3 d8 1c 17 9a   ....fG)}........
0090  85 5a 42 16 7a 23 e3 b2 24 9f 5a df 48 a7 14 f8   .ZB.z#..$.Z.H...
00a0  51 aa f4 39 e3 ab 79 72 00 00 aa 55               Q..9..yr...U

No.     Time           Source                Destination           Protocol Length Info
      4 0.716458       Espressif_61:c4:5d    Broadcast             ARP      60     ARP Announcement for 192.168.0.158

Frame 4: 60 bytes on wire (480 bits), 60 bytes captured (480 bits) on interface \Device\NPF_{602D7947-81A3-478C-A47A-FCA514C4404E}, id 0
    Section number: 1
    Interface id: 0 (\Device\NPF_{602D7947-81A3-478C-A47A-FCA514C4404E})
        Interface name: \Device\NPF_{602D7947-81A3-478C-A47A-FCA514C4404E}
        Interface description: Wi-Fi
    Encapsulation type: Ethernet (1)
    Arrival Time: Mar 15, 2025 12:04:46.834775000 W. Europe Standard Time
    UTC Arrival Time: Mar 15, 2025 11:04:46.834775000 UTC
    Epoch Arrival Time: 1742036686.834775000
    [Time shift for this packet: 0.000000000 seconds]
    [Time delta from previous captured frame: 0.204657000 seconds]
    [Time delta from previous displayed frame: 0.204657000 seconds]
    [Time since reference or first frame: 0.716458000 seconds]
    Frame Number: 4
    Frame Length: 60 bytes (480 bits)
    Capture Length: 60 bytes (480 bits)
    [Frame is marked: False]
    [Frame is ignored: False]
    [Protocols in frame: eth:ethertype:arp]
    [Coloring Rule Name: ARP]
    [Coloring Rule String: arp]
Ethernet II, Src: Espressif_61:c4:5d (48:e7:29:61:c4:5d), Dst: Broadcast (ff:ff:ff:ff:ff:ff)
    Destination: Broadcast (ff:ff:ff:ff:ff:ff)
        .... ..1. .... .... .... .... = LG bit: Locally administered address (this is NOT the factory default)
        .... ...1 .... .... .... .... = IG bit: Group address (multicast/broadcast)
    Source: Espressif_61:c4:5d (48:e7:29:61:c4:5d)
        .... ..0. .... .... .... .... = LG bit: Globally unique address (factory default)
        .... ...0 .... .... .... .... = IG bit: Individual address (unicast)
    Type: ARP (0x0806)
    [Stream index: 1]
    Padding: 000000000000000000000000000000000000
Address Resolution Protocol (ARP Announcement)

No.     Time           Source                Destination           Protocol Length Info
      5 0.819651       192.168.0.150         255.255.255.255       UDP      482    2021 → 2021 Len=440

Frame 5: 482 bytes on wire (3856 bits), 482 bytes captured (3856 bits) on interface \Device\NPF_{602D7947-81A3-478C-A47A-FCA514C4404E}, id 0
    Section number: 1
    Interface id: 0 (\Device\NPF_{602D7947-81A3-478C-A47A-FCA514C4404E})
        Interface name: \Device\NPF_{602D7947-81A3-478C-A47A-FCA514C4404E}
        Interface description: Wi-Fi
    Encapsulation type: Ethernet (1)
    Arrival Time: Mar 15, 2025 12:04:46.937968000 W. Europe Standard Time
    UTC Arrival Time: Mar 15, 2025 11:04:46.937968000 UTC
    Epoch Arrival Time: 1742036686.937968000
    [Time shift for this packet: 0.000000000 seconds]
    [Time delta from previous captured frame: 0.103193000 seconds]
    [Time delta from previous displayed frame: 0.103193000 seconds]
    [Time since reference or first frame: 0.819651000 seconds]
    Frame Number: 5
    Frame Length: 482 bytes (3856 bits)
    Capture Length: 482 bytes (3856 bits)
    [Frame is marked: False]
    [Frame is ignored: False]
    [Protocols in frame: eth:ethertype:ip:udp:data]
    [Coloring Rule Name: UDP]
    [Coloring Rule String: udp]
Ethernet II, Src: TendaTechnol_4b:7e:09 (cc:2d:21:4b:7e:09), Dst: Broadcast (ff:ff:ff:ff:ff:ff)
    Destination: Broadcast (ff:ff:ff:ff:ff:ff)
        .... ..1. .... .... .... .... = LG bit: Locally administered address (this is NOT the factory default)
        .... ...1 .... .... .... .... = IG bit: Group address (multicast/broadcast)
    Source: TendaTechnol_4b:7e:09 (cc:2d:21:4b:7e:09)
        .... ..0. .... .... .... .... = LG bit: Globally unique address (factory default)
        .... ...0 .... .... .... .... = IG bit: Individual address (unicast)
    Type: IPv4 (0x0800)
    [Stream index: 0]
Internet Protocol Version 4, Src: 192.168.0.150, Dst: 255.255.255.255
    0100 .... = Version: 4
    .... 0101 = Header Length: 20 bytes (5)
    Differentiated Services Field: 0x00 (DSCP: CS0, ECN: Not-ECT)
        0000 00.. = Differentiated Services Codepoint: Default (0)
        .... ..00 = Explicit Congestion Notification: Not ECN-Capable Transport (0)
    Total Length: 468
    Identification: 0x8799 (34713)
    010. .... = Flags: 0x2, Don't fragment
        0... .... = Reserved bit: Not set
        .1.. .... = Don't fragment: Set
        ..0. .... = More fragments: Not set
    ...0 0000 0000 0000 = Fragment Offset: 0
    Time to Live: 64
    Protocol: UDP (17)
    Header Checksum: 0xf041 [validation disabled]
    [Header checksum status: Unverified]
    Source Address: 192.168.0.150
    Destination Address: 255.255.255.255
    [Stream index: 2]
User Datagram Protocol, Src Port: 2021, Dst Port: 2021
Data (440 bytes)

0000  4e 4f 54 49 46 59 20 2a 20 48 54 54 50 2f 31 2e   NOTIFY * HTTP/1.
0010  31 0d 0a 48 6f 73 74 3a 20 32 33 39 2e 32 35 35   1..Host: 239.255
0020  2e 32 35 35 2e 32 35 30 3a 31 39 39 30 0d 0a 53   .255.250:1990..S
0030  65 72 76 65 72 3a 20 55 50 6e 50 2f 31 2e 30 0d   erver: UPnP/1.0.
0040  0a 4c 6f 63 61 74 69 6f 6e 3a 20 31 39 32 2e 31   .Location: 192.1
0050  36 38 2e 30 2e 31 35 30 0d 0a 4e 54 3a 20 75 72   68.0.150..NT: ur
0060  6e 3a 62 61 6d 62 75 6c 61 62 2d 63 6f 6d 3a 64   n:bambulab-com:d
0070  65 76 69 63 65 3a 33 64 70 72 69 6e 74 65 72 3a   evice:3dprinter:
0080  31 0d 0a 4e 54 53 3a 20 73 73 64 70 3a 61 6c 69   1..NTS: ssdp:ali
0090  76 65 0d 0a 55 53 4e 3a 20 30 30 4d 30 39 43 34   ve..USN: 00M09C4
00a0  35 30 37 30 30 32 38 35 0d 0a 43 61 63 68 65 2d   50700285..Cache-
00b0  43 6f 6e 74 72 6f 6c 3a 20 6d 61 78 2d 61 67 65   Control: max-age
00c0  3d 31 38 30 30 0d 0a 44 65 76 4d 6f 64 65 6c 2e   =1800..DevModel.
00d0  62 61 6d 62 75 2e 63 6f 6d 3a 20 42 4c 2d 50 30   bambu.com: BL-P0
00e0  30 31 0d 0a 44 65 76 4e 61 6d 65 2e 62 61 6d 62   01..DevName.bamb
00f0  75 2e 63 6f 6d 3a 20 44 76 69 64 4d 61 6b 65 73   u.com: DvidMakes
0100  54 68 69 6e 67 73 0d 0a 44 65 76 53 69 67 6e 61   Things..DevSigna
0110  6c 2e 62 61 6d 62 75 2e 63 6f 6d 3a 20 2d 33 35   l.bambu.com: -35
0120  0d 0a 44 65 76 43 6f 6e 6e 65 63 74 2e 62 61 6d   ..DevConnect.bam
0130  62 75 2e 63 6f 6d 3a 20 63 6c 6f 75 64 0d 0a 44   bu.com: cloud..D
0140  65 76 42 69 6e 64 2e 62 61 6d 62 75 2e 63 6f 6d   evBind.bambu.com
0150  3a 20 6f 63 63 75 70 69 65 64 0d 0a 44 65 76 73   : occupied..Devs
0160  65 63 6c 69 6e 6b 2e 62 61 6d 62 75 2e 63 6f 6d   eclink.bambu.com
0170  3a 20 73 65 63 75 72 65 0d 0a 44 65 76 49 6e 66   : secure..DevInf
0180  2e 62 61 6d 62 75 2e 63 6f 6d 3a 20 77 6c 61 6e   .bambu.com: wlan
0190  30 0d 0a 44 65 76 56 65 72 73 69 6f 6e 2e 62 61   0..DevVersion.ba
01a0  6d 62 75 2e 63 6f 6d 3a 20 30 31 2e 30 38 2e 30   mbu.com: 01.08.0
01b0  35 2e 30 30 0d 0a 0d 0a                           5.00....

No.     Time           Source                Destination           Protocol Length Info
      6 0.977568       2a02:8388:1a84:3380:78f9:cad2:3903:1d40 2a02:8388:1a84:3380:10:18ff:fe2e:d1ec DNS      114    Standard query 0xff6c A p2p-fra1.discovery.steamserver.net

Frame 6: 114 bytes on wire (912 bits), 114 bytes captured (912 bits) on interface \Device\NPF_{602D7947-81A3-478C-A47A-FCA514C4404E}, id 0
    Section number: 1
    Interface id: 0 (\Device\NPF_{602D7947-81A3-478C-A47A-FCA514C4404E})
        Interface name: \Device\NPF_{602D7947-81A3-478C-A47A-FCA514C4404E}
        Interface description: Wi-Fi
    Encapsulation type: Ethernet (1)
    Arrival Time: Mar 15, 2025 12:04:47.095885000 W. Europe Standard Time
    UTC Arrival Time: Mar 15, 2025 11:04:47.095885000 UTC
    Epoch Arrival Time: 1742036687.095885000
    [Time shift for this packet: 0.000000000 seconds]
    [Time delta from previous captured frame: 0.157917000 seconds]
    [Time delta from previous displayed frame: 0.157917000 seconds]
    [Time since reference or first frame: 0.977568000 seconds]
    Frame Number: 6
    Frame Length: 114 bytes (912 bits)
    Capture Length: 114 bytes (912 bits)
    [Frame is marked: False]
    [Frame is ignored: False]
    [Protocols in frame: eth:ethertype:ipv6:udp:dns]
    [Coloring Rule Name: UDP]
    [Coloring Rule String: udp]
Ethernet II, Src: Intel_53:09:21 (e8:c8:29:53:09:21), Dst: MS-NLB-PhysServer-16_18:2e:d1:ec (02:10:18:2e:d1:ec)
    Destination: MS-NLB-PhysServer-16_18:2e:d1:ec (02:10:18:2e:d1:ec)
        .... ..1. .... .... .... .... = LG bit: Locally administered address (this is NOT the factory default)
        .... ...0 .... .... .... .... = IG bit: Individual address (unicast)
    Source: Intel_53:09:21 (e8:c8:29:53:09:21)
        .... ..0. .... .... .... .... = LG bit: Globally unique address (factory default)
        .... ...0 .... .... .... .... = IG bit: Individual address (unicast)
    Type: IPv6 (0x86dd)
    [Stream index: 2]
Internet Protocol Version 6, Src: 2a02:8388:1a84:3380:78f9:cad2:3903:1d40, Dst: 2a02:8388:1a84:3380:10:18ff:fe2e:d1ec
User Datagram Protocol, Src Port: 58836, Dst Port: 53
Domain Name System (query)

No.     Time           Source                Destination           Protocol Length Info
      7 0.987789       2a02:8388:1a84:3380:10:18ff:fe2e:d1ec 2a02:8388:1a84:3380:78f9:cad2:3903:1d40 DNS      178    Standard query response 0xff6c A p2p-fra1.discovery.steamserver.net A 162.254.197.40 A 162.254.197.54 A 162.254.197.39 A 162.254.197.38

Frame 7: 178 bytes on wire (1424 bits), 178 bytes captured (1424 bits) on interface \Device\NPF_{602D7947-81A3-478C-A47A-FCA514C4404E}, id 0
    Section number: 1
    Interface id: 0 (\Device\NPF_{602D7947-81A3-478C-A47A-FCA514C4404E})
        Interface name: \Device\NPF_{602D7947-81A3-478C-A47A-FCA514C4404E}
        Interface description: Wi-Fi
    Encapsulation type: Ethernet (1)
    Arrival Time: Mar 15, 2025 12:04:47.106106000 W. Europe Standard Time
    UTC Arrival Time: Mar 15, 2025 11:04:47.106106000 UTC
    Epoch Arrival Time: 1742036687.106106000
    [Time shift for this packet: 0.000000000 seconds]
    [Time delta from previous captured frame: 0.010221000 seconds]
    [Time delta from previous displayed frame: 0.010221000 seconds]
    [Time since reference or first frame: 0.987789000 seconds]
    Frame Number: 7
    Frame Length: 178 bytes (1424 bits)
    Capture Length: 178 bytes (1424 bits)
    [Frame is marked: False]
    [Frame is ignored: False]
    [Protocols in frame: eth:ethertype:ipv6:udp:dns]
    [Coloring Rule Name: UDP]
    [Coloring Rule String: udp]
Ethernet II, Src: MS-NLB-PhysServer-16_18:2e:d1:ec (02:10:18:2e:d1:ec), Dst: Intel_53:09:21 (e8:c8:29:53:09:21)
    Destination: Intel_53:09:21 (e8:c8:29:53:09:21)
        .... ..0. .... .... .... .... = LG bit: Globally unique address (factory default)
        .... ...0 .... .... .... .... = IG bit: Individual address (unicast)
    Source: MS-NLB-PhysServer-16_18:2e:d1:ec (02:10:18:2e:d1:ec)
        .... ..1. .... .... .... .... = LG bit: Locally administered address (this is NOT the factory default)
        .... ...0 .... .... .... .... = IG bit: Individual address (unicast)
    Type: IPv6 (0x86dd)
    [Stream index: 2]
Internet Protocol Version 6, Src: 2a02:8388:1a84:3380:10:18ff:fe2e:d1ec, Dst: 2a02:8388:1a84:3380:78f9:cad2:3903:1d40
User Datagram Protocol, Src Port: 53, Dst Port: 58836
Domain Name System (response)

No.     Time           Source                Destination           Protocol Length Info
      8 1.023587       SamsungElect_a4:b1:97 Broadcast             ARP      60     Who has 192.168.0.1? Tell 192.168.0.148

Frame 8: 60 bytes on wire (480 bits), 60 bytes captured (480 bits) on interface \Device\NPF_{602D7947-81A3-478C-A47A-FCA514C4404E}, id 0
    Section number: 1
    Interface id: 0 (\Device\NPF_{602D7947-81A3-478C-A47A-FCA514C4404E})
        Interface name: \Device\NPF_{602D7947-81A3-478C-A47A-FCA514C4404E}
        Interface description: Wi-Fi
    Encapsulation type: Ethernet (1)
    Arrival Time: Mar 15, 2025 12:04:47.141904000 W. Europe Standard Time
    UTC Arrival Time: Mar 15, 2025 11:04:47.141904000 UTC
    Epoch Arrival Time: 1742036687.141904000
    [Time shift for this packet: 0.000000000 seconds]
    [Time delta from previous captured frame: 0.035798000 seconds]
    [Time delta from previous displayed frame: 0.035798000 seconds]
    [Time since reference or first frame: 1.023587000 seconds]
    Frame Number: 8
    Frame Length: 60 bytes (480 bits)
    Capture Length: 60 bytes (480 bits)
    [Frame is marked: False]
    [Frame is ignored: False]
    [Protocols in frame: eth:ethertype:arp]
    [Coloring Rule Name: ARP]
    [Coloring Rule String: arp]
Ethernet II, Src: SamsungElect_a4:b1:97 (64:1c:b0:a4:b1:97), Dst: Broadcast (ff:ff:ff:ff:ff:ff)
    Destination: Broadcast (ff:ff:ff:ff:ff:ff)
        .... ..1. .... .... .... .... = LG bit: Locally administered address (this is NOT the factory default)
        .... ...1 .... .... .... .... = IG bit: Group address (multicast/broadcast)
    Source: SamsungElect_a4:b1:97 (64:1c:b0:a4:b1:97)
        .... ..0. .... .... .... .... = LG bit: Globally unique address (factory default)
        .... ...0 .... .... .... .... = IG bit: Individual address (unicast)
    Type: ARP (0x0806)
    [Stream index: 3]
    Padding: 000000000000000000000000000000000000
Address Resolution Protocol (request)

No.     Time           Source                Destination           Protocol Length Info
      9 1.025895       192.168.0.152         255.255.255.255       UDP      304    53658 → 6667 Len=262

Frame 9: 304 bytes on wire (2432 bits), 304 bytes captured (2432 bits) on interface \Device\NPF_{602D7947-81A3-478C-A47A-FCA514C4404E}, id 0
    Section number: 1
    Interface id: 0 (\Device\NPF_{602D7947-81A3-478C-A47A-FCA514C4404E})
        Interface name: \Device\NPF_{602D7947-81A3-478C-A47A-FCA514C4404E}
        Interface description: Wi-Fi
    Encapsulation type: Ethernet (1)
    Arrival Time: Mar 15, 2025 12:04:47.144212000 W. Europe Standard Time
    UTC Arrival Time: Mar 15, 2025 11:04:47.144212000 UTC
    Epoch Arrival Time: 1742036687.144212000
    [Time shift for this packet: 0.000000000 seconds]
    [Time delta from previous captured frame: 0.002308000 seconds]
    [Time delta from previous displayed frame: 0.002308000 seconds]
    [Time since reference or first frame: 1.025895000 seconds]
    Frame Number: 9
    Frame Length: 304 bytes (2432 bits)
    Capture Length: 304 bytes (2432 bits)
    [Frame is marked: False]
    [Frame is ignored: False]
    [Protocols in frame: eth:ethertype:ip:udp:data]
    [Coloring Rule Name: UDP]
    [Coloring Rule String: udp]
Ethernet II, Src: TuyaSmart_27:f6:3d (4c:a9:19:27:f6:3d), Dst: Broadcast (ff:ff:ff:ff:ff:ff)
    Destination: Broadcast (ff:ff:ff:ff:ff:ff)
        .... ..1. .... .... .... .... = LG bit: Locally administered address (this is NOT the factory default)
        .... ...1 .... .... .... .... = IG bit: Group address (multicast/broadcast)
    Source: TuyaSmart_27:f6:3d (4c:a9:19:27:f6:3d)
        .... ..0. .... .... .... .... = LG bit: Globally unique address (factory default)
        .... ...0 .... .... .... .... = IG bit: Individual address (unicast)
    Type: IPv4 (0x0800)
    [Stream index: 4]
Internet Protocol Version 4, Src: 192.168.0.152, Dst: 255.255.255.255
    0100 .... = Version: 4
    .... 0101 = Header Length: 20 bytes (5)
    Differentiated Services Field: 0x00 (DSCP: CS0, ECN: Not-ECT)
        0000 00.. = Differentiated Services Codepoint: Default (0)
        .... ..00 = Explicit Congestion Notification: Not ECN-Capable Transport (0)
    Total Length: 290
    Identification: 0x8097 (32919)
    000. .... = Flags: 0x0
        0... .... = Reserved bit: Not set
        .0.. .... = Don't fragment: Not set
        ..0. .... = More fragments: Not set
    ...0 0000 0000 0000 = Fragment Offset: 0
    Time to Live: 255
    Protocol: UDP (17)
    Header Checksum: 0x78f3 [validation disabled]
    [Header checksum status: Unverified]
    Source Address: 192.168.0.152
    Destination Address: 255.255.255.255
    [Stream index: 3]
User Datagram Protocol, Src Port: 53658, Dst Port: 6667
Data (262 bytes)

0000  00 00 66 99 00 00 00 00 00 00 00 00 00 13 00 00   ..f.............
0010  00 f0 cb 10 ce ca 31 e6 8a 60 ba 95 b5 2c 9f bb   ......1..`...,..
0020  d1 fe d1 53 c3 38 55 1e a7 c7 d3 b6 fd e4 8a b2   ...S.8U.........
0030  fa 35 1e 61 70 9b 9f 9c aa d3 31 c8 ba f6 90 ca   .5.ap.....1.....
0040  49 3d b3 35 e4 38 23 0f ad c7 2f e7 1c c3 2a 67   I=.5.8#.../...*g
0050  a7 20 a4 1b 46 06 ea 95 15 db f5 a5 f5 41 83 de   . ..F........A..
0060  fa 32 82 8d e8 0c e2 9d 6a 87 ab f1 1e a8 91 38   .2......j......8
0070  c7 a1 fc 90 a5 c7 17 51 92 38 2e 0b 79 d3 fc 31   .......Q.8..y..1
0080  9a 28 55 5e f8 81 3c 81 42 c5 dd 56 6b f6 e0 61   .(U^..<.B..Vk..a
0090  33 b4 c6 7c 0e 43 b3 57 84 bc ab 9f 52 65 d1 8f   3..|.C.W....Re..
00a0  49 72 eb 0a 2b e3 29 26 a2 d9 bc b6 5d 0c 77 8e   Ir..+.)&....].w.
00b0  c6 b5 48 a5 f6 34 43 d7 d6 df 29 c3 56 59 10 88   ..H..4C...).VY..
00c0  e5 ff c4 4a 2f 87 3a 8c 89 43 76 2d 4c 96 59 c1   ...J/.:..Cv-L.Y.
00d0  48 75 ae 0f e9 e9 ac 91 30 4f 08 5d ab 8f 0b c8   Hu......0O.]....
00e0  31 12 47 f4 89 06 61 59 5b 2b c7 25 e7 0d 61 39   1.G...aY[+.%..a9
00f0  22 4c 8c ea 8c f2 6f 62 ca 94 a0 cf 75 e3 d8 12   "L....ob....u...
0100  9a 71 00 00 99 66                                 .q...f

No.     Time           Source                Destination           Protocol Length Info
     10 1.040165       192.168.0.226         192.168.0.11          TCP      66     4295 → 80 [SYN] Seq=0 Win=65535 Len=0 MSS=1460 WS=256 SACK_PERM

Frame 10: 66 bytes on wire (528 bits), 66 bytes captured (528 bits) on interface \Device\NPF_{602D7947-81A3-478C-A47A-FCA514C4404E}, id 0
    Section number: 1
    Interface id: 0 (\Device\NPF_{602D7947-81A3-478C-A47A-FCA514C4404E})
        Interface name: \Device\NPF_{602D7947-81A3-478C-A47A-FCA514C4404E}
        Interface description: Wi-Fi
    Encapsulation type: Ethernet (1)
    Arrival Time: Mar 15, 2025 12:04:47.158482000 W. Europe Standard Time
    UTC Arrival Time: Mar 15, 2025 11:04:47.158482000 UTC
    Epoch Arrival Time: 1742036687.158482000
    [Time shift for this packet: 0.000000000 seconds]
    [Time delta from previous captured frame: 0.014270000 seconds]
    [Time delta from previous displayed frame: 0.014270000 seconds]
    [Time since reference or first frame: 1.040165000 seconds]
    Frame Number: 10
    Frame Length: 66 bytes (528 bits)
    Capture Length: 66 bytes (528 bits)
    [Frame is marked: False]
    [Frame is ignored: False]
    [Protocols in frame: eth:ethertype:ip:tcp]
    [Coloring Rule Name: HTTP]
    [Coloring Rule String: http || tcp.port == 80 || http2]
Ethernet II, Src: Intel_53:09:21 (e8:c8:29:53:09:21), Dst: TendaTechnol_4b:7e:09 (cc:2d:21:4b:7e:09)
    Destination: TendaTechnol_4b:7e:09 (cc:2d:21:4b:7e:09)
        .... ..0. .... .... .... .... = LG bit: Globally unique address (factory default)
        .... ...0 .... .... .... .... = IG bit: Individual address (unicast)
    Source: Intel_53:09:21 (e8:c8:29:53:09:21)
        .... ..0. .... .... .... .... = LG bit: Globally unique address (factory default)
        .... ...0 .... .... .... .... = IG bit: Individual address (unicast)
    Type: IPv4 (0x0800)
    [Stream index: 5]
Internet Protocol Version 4, Src: 192.168.0.226, Dst: 192.168.0.11
    0100 .... = Version: 4
    .... 0101 = Header Length: 20 bytes (5)
    Differentiated Services Field: 0x00 (DSCP: CS0, ECN: Not-ECT)
        0000 00.. = Differentiated Services Codepoint: Default (0)
        .... ..00 = Explicit Congestion Notification: Not ECN-Capable Transport (0)
    Total Length: 52
    Identification: 0xbfb0 (49072)
    010. .... = Flags: 0x2, Don't fragment
        0... .... = Reserved bit: Not set
        .1.. .... = Don't fragment: Set
        ..0. .... = More fragments: Not set
    ...0 0000 0000 0000 = Fragment Offset: 0
    Time to Live: 128
    Protocol: TCP (6)
    Header Checksum: 0x0000 [validation disabled]
    [Header checksum status: Unverified]
    Source Address: 192.168.0.226
    Destination Address: 192.168.0.11
    [Stream index: 4]
Transmission Control Protocol, Src Port: 4295, Dst Port: 80, Seq: 0, Len: 0
    Source Port: 4295
    Destination Port: 80
    [Stream index: 0]
    [Stream Packet Number: 1]
    [Conversation completeness: Complete, WITH_DATA (47)]
        ..1. .... = RST: Present
        ...0 .... = FIN: Absent
        .... 1... = Data: Present
        .... .1.. = ACK: Present
        .... ..1. = SYN-ACK: Present
        .... ...1 = SYN: Present
        [Completeness Flags: R·DASS]
    [TCP Segment Len: 0]
    Sequence Number: 0    (relative sequence number)
    Sequence Number (raw): 1099145291
    [Next Sequence Number: 1    (relative sequence number)]
    Acknowledgment Number: 0
    Acknowledgment number (raw): 0
    1000 .... = Header Length: 32 bytes (8)
    Flags: 0x002 (SYN)
        000. .... .... = Reserved: Not set
        ...0 .... .... = Accurate ECN: Not set
        .... 0... .... = Congestion Window Reduced: Not set
        .... .0.. .... = ECN-Echo: Not set
        .... ..0. .... = Urgent: Not set
        .... ...0 .... = Acknowledgment: Not set
        .... .... 0... = Push: Not set
        .... .... .0.. = Reset: Not set
        .... .... ..1. = Syn: Set
        .... .... ...0 = Fin: Not set
        [TCP Flags: ··········S·]
    Window: 65535
    [Calculated window size: 65535]
    Checksum: 0x8264 [unverified]
    [Checksum Status: Unverified]
    Urgent Pointer: 0
    Options: (12 bytes), Maximum segment size, No-Operation (NOP), Window scale, No-Operation (NOP), No-Operation (NOP), SACK permitted
    [Timestamps]
        [Time since first frame in this TCP stream: 0.000000000 seconds]
        [Time since previous frame in this TCP stream: 0.000000000 seconds]

No.     Time           Source                Destination           Protocol Length Info
     11 1.047432       192.168.0.11          192.168.0.226         TCP      60     80 → 4295 [SYN, ACK] Seq=0 Ack=1 Win=2048 Len=0 MSS=1460

Frame 11: 60 bytes on wire (480 bits), 60 bytes captured (480 bits) on interface \Device\NPF_{602D7947-81A3-478C-A47A-FCA514C4404E}, id 0
    Section number: 1
    Interface id: 0 (\Device\NPF_{602D7947-81A3-478C-A47A-FCA514C4404E})
        Interface name: \Device\NPF_{602D7947-81A3-478C-A47A-FCA514C4404E}
        Interface description: Wi-Fi
    Encapsulation type: Ethernet (1)
    Arrival Time: Mar 15, 2025 12:04:47.165749000 W. Europe Standard Time
    UTC Arrival Time: Mar 15, 2025 11:04:47.165749000 UTC
    Epoch Arrival Time: 1742036687.165749000
    [Time shift for this packet: 0.000000000 seconds]
    [Time delta from previous captured frame: 0.007267000 seconds]
    [Time delta from previous displayed frame: 0.007267000 seconds]
    [Time since reference or first frame: 1.047432000 seconds]
    Frame Number: 11
    Frame Length: 60 bytes (480 bits)
    Capture Length: 60 bytes (480 bits)
    [Frame is marked: False]
    [Frame is ignored: False]
    [Protocols in frame: eth:ethertype:ip:tcp]
    [Coloring Rule Name: HTTP]
    [Coloring Rule String: http || tcp.port == 80 || http2]
Ethernet II, Src: TendaTechnol_4b:7e:09 (cc:2d:21:4b:7e:09), Dst: Intel_53:09:21 (e8:c8:29:53:09:21)
    Destination: Intel_53:09:21 (e8:c8:29:53:09:21)
        .... ..0. .... .... .... .... = LG bit: Globally unique address (factory default)
        .... ...0 .... .... .... .... = IG bit: Individual address (unicast)
    Source: TendaTechnol_4b:7e:09 (cc:2d:21:4b:7e:09)
        .... ..0. .... .... .... .... = LG bit: Globally unique address (factory default)
        .... ...0 .... .... .... .... = IG bit: Individual address (unicast)
    Type: IPv4 (0x0800)
    [Stream index: 5]
    Padding: 0000
Internet Protocol Version 4, Src: 192.168.0.11, Dst: 192.168.0.226
    0100 .... = Version: 4
    .... 0101 = Header Length: 20 bytes (5)
    Differentiated Services Field: 0x00 (DSCP: CS0, ECN: Not-ECT)
        0000 00.. = Differentiated Services Codepoint: Default (0)
        .... ..00 = Explicit Congestion Notification: Not ECN-Capable Transport (0)
    Total Length: 44
    Identification: 0x0001 (1)
    010. .... = Flags: 0x2, Don't fragment
        0... .... = Reserved bit: Not set
        .1.. .... = Don't fragment: Set
        ..0. .... = More fragments: Not set
    ...0 0000 0000 0000 = Fragment Offset: 0
    Time to Live: 128
    Protocol: TCP (6)
    Header Checksum: 0x788d [validation disabled]
    [Header checksum status: Unverified]
    Source Address: 192.168.0.11
    Destination Address: 192.168.0.226
    [Stream index: 4]
Transmission Control Protocol, Src Port: 80, Dst Port: 4295, Seq: 0, Ack: 1, Len: 0
    Source Port: 80
    Destination Port: 4295
    [Stream index: 0]
    [Stream Packet Number: 2]
    [Conversation completeness: Complete, WITH_DATA (47)]
        ..1. .... = RST: Present
        ...0 .... = FIN: Absent
        .... 1... = Data: Present
        .... .1.. = ACK: Present
        .... ..1. = SYN-ACK: Present
        .... ...1 = SYN: Present
        [Completeness Flags: R·DASS]
    [TCP Segment Len: 0]
    Sequence Number: 0    (relative sequence number)
    Sequence Number (raw): 2958269216
    [Next Sequence Number: 1    (relative sequence number)]
    Acknowledgment Number: 1    (relative ack number)
    Acknowledgment number (raw): 1099145292
    0110 .... = Header Length: 24 bytes (6)
    Flags: 0x012 (SYN, ACK)
        000. .... .... = Reserved: Not set
        ...0 .... .... = Accurate ECN: Not set
        .... 0... .... = Congestion Window Reduced: Not set
        .... .0.. .... = ECN-Echo: Not set
        .... ..0. .... = Urgent: Not set
        .... ...1 .... = Acknowledgment: Set
        .... .... 0... = Push: Not set
        .... .... .0.. = Reset: Not set
        .... .... ..1. = Syn: Set
        .... .... ...0 = Fin: Not set
        [TCP Flags: ·······A··S·]
    Window: 2048
    [Calculated window size: 2048]
    Checksum: 0xcf7d [unverified]
    [Checksum Status: Unverified]
    Urgent Pointer: 0
    Options: (4 bytes), Maximum segment size
    [Timestamps]
        [Time since first frame in this TCP stream: 0.007267000 seconds]
        [Time since previous frame in this TCP stream: 0.007267000 seconds]
    [SEQ/ACK analysis]
        [This is an ACK to the segment in frame: 10]
        [The RTT to ACK the segment was: 0.007267000 seconds]
        [iRTT: 0.007368000 seconds]

No.     Time           Source                Destination           Protocol Length Info
     12 1.047533       192.168.0.226         192.168.0.11          TCP      54     4295 → 80 [ACK] Seq=1 Ack=1 Win=65535 Len=0

Frame 12: 54 bytes on wire (432 bits), 54 bytes captured (432 bits) on interface \Device\NPF_{602D7947-81A3-478C-A47A-FCA514C4404E}, id 0
    Section number: 1
    Interface id: 0 (\Device\NPF_{602D7947-81A3-478C-A47A-FCA514C4404E})
        Interface name: \Device\NPF_{602D7947-81A3-478C-A47A-FCA514C4404E}
        Interface description: Wi-Fi
    Encapsulation type: Ethernet (1)
    Arrival Time: Mar 15, 2025 12:04:47.165850000 W. Europe Standard Time
    UTC Arrival Time: Mar 15, 2025 11:04:47.165850000 UTC
    Epoch Arrival Time: 1742036687.165850000
    [Time shift for this packet: 0.000000000 seconds]
    [Time delta from previous captured frame: 0.000101000 seconds]
    [Time delta from previous displayed frame: 0.000101000 seconds]
    [Time since reference or first frame: 1.047533000 seconds]
    Frame Number: 12
    Frame Length: 54 bytes (432 bits)
    Capture Length: 54 bytes (432 bits)
    [Frame is marked: False]
    [Frame is ignored: False]
    [Protocols in frame: eth:ethertype:ip:tcp]
    [Coloring Rule Name: HTTP]
    [Coloring Rule String: http || tcp.port == 80 || http2]
Ethernet II, Src: Intel_53:09:21 (e8:c8:29:53:09:21), Dst: TendaTechnol_4b:7e:09 (cc:2d:21:4b:7e:09)
    Destination: TendaTechnol_4b:7e:09 (cc:2d:21:4b:7e:09)
        .... ..0. .... .... .... .... = LG bit: Globally unique address (factory default)
        .... ...0 .... .... .... .... = IG bit: Individual address (unicast)
    Source: Intel_53:09:21 (e8:c8:29:53:09:21)
        .... ..0. .... .... .... .... = LG bit: Globally unique address (factory default)
        .... ...0 .... .... .... .... = IG bit: Individual address (unicast)
    Type: IPv4 (0x0800)
    [Stream index: 5]
Internet Protocol Version 4, Src: 192.168.0.226, Dst: 192.168.0.11
    0100 .... = Version: 4
    .... 0101 = Header Length: 20 bytes (5)
    Differentiated Services Field: 0x00 (DSCP: CS0, ECN: Not-ECT)
        0000 00.. = Differentiated Services Codepoint: Default (0)
        .... ..00 = Explicit Congestion Notification: Not ECN-Capable Transport (0)
    Total Length: 40
    Identification: 0xbfb1 (49073)
    010. .... = Flags: 0x2, Don't fragment
        0... .... = Reserved bit: Not set
        .1.. .... = Don't fragment: Set
        ..0. .... = More fragments: Not set
    ...0 0000 0000 0000 = Fragment Offset: 0
    Time to Live: 128
    Protocol: TCP (6)
    Header Checksum: 0x0000 [validation disabled]
    [Header checksum status: Unverified]
    Source Address: 192.168.0.226
    Destination Address: 192.168.0.11
    [Stream index: 4]
Transmission Control Protocol, Src Port: 4295, Dst Port: 80, Seq: 1, Ack: 1, Len: 0
    Source Port: 4295
    Destination Port: 80
    [Stream index: 0]
    [Stream Packet Number: 3]
    [Conversation completeness: Complete, WITH_DATA (47)]
        ..1. .... = RST: Present
        ...0 .... = FIN: Absent
        .... 1... = Data: Present
        .... .1.. = ACK: Present
        .... ..1. = SYN-ACK: Present
        .... ...1 = SYN: Present
        [Completeness Flags: R·DASS]
    [TCP Segment Len: 0]
    Sequence Number: 1    (relative sequence number)
    Sequence Number (raw): 1099145292
    [Next Sequence Number: 1    (relative sequence number)]
    Acknowledgment Number: 1    (relative ack number)
    Acknowledgment number (raw): 2958269217
    0101 .... = Header Length: 20 bytes (5)
    Flags: 0x010 (ACK)
        000. .... .... = Reserved: Not set
        ...0 .... .... = Accurate ECN: Not set
        .... 0... .... = Congestion Window Reduced: Not set
        .... .0.. .... = ECN-Echo: Not set
        .... ..0. .... = Urgent: Not set
        .... ...1 .... = Acknowledgment: Set
        .... .... 0... = Push: Not set
        .... .... .0.. = Reset: Not set
        .... .... ..0. = Syn: Not set
